,query,relevant_ids,non_relevant_ids,video_id,sentence
357,some people video conferencing as they watch a movie,['video7346'],"['video7027', 'video7175', 'video7178', 'video7444', 'video7593', 'video7685', 'video8334', 'video8472', 'video8772', 'video8800', 'video8930', 'video9309', 'video9404', 'video9679', 'video9685', 'video9688', 'video9750', 'video9835']",video7346,some people video conferencing as they watch a movie
359,a guy wearing a black shirt talks and shows a chart on the tv screen,['video7064'],"['video7119', 'video7163', 'video7412', 'video7418', 'video7432', 'video7580', 'video7610', 'video7699', 'video7754', 'video7799', 'video7834', 'video7890', 'video7970', 'video8077', 'video8263', 'video8328', 'video8839', 'video9012', 'video9239', 'video9687', 'video9689', 'video9691', 'video9805', 'video9815', 'video9829']",video7064,a guy wearing a black shirt talks and shows a chart on the tv screen
360,video game of a truck driving through desert obstacles,['video9336'],"['video7352', 'video7445', 'video7506', 'video7701', 'video7731', 'video7919', 'video8070', 'video8426', 'video8450', 'video8468', 'video8674', 'video8677', 'video8689', 'video8921', 'video9014', 'video9344', 'video9355', 'video9450', 'video9517', 'video9682', 'video9832']",video9336,video game of a truck driving through desert obstacles
364,polar bear jumps into water then plays around while people watch,['video8493'],"['video7061', 'video7118', 'video7131', 'video7152', 'video7946', 'video8079', 'video8243', 'video8332', 'video8453', 'video8485', 'video8935', 'video8949', 'video9221', 'video9253', 'video9321', 'video9328', 'video9578', 'video9816', 'video9835']",video8493,polar bear jumps into water then plays around while people watch
372,kids in a circle play with beach ball and surf boards,['video8339'],"['video7112', 'video7117', 'video7355', 'video7542', 'video7571', 'video7599', 'video7613', 'video7845', 'video8048', 'video8068', 'video8241', 'video8247', 'video8327', 'video8578', 'video8622', 'video8676', 'video8685', 'video8721', 'video8815', 'video8818', 'video8904', 'video9230', 'video9320', 'video9338', 'video9576', 'video9677']",video8339,kids in a circle play with beach ball and surf boards
373,a cartoon shows two dogs talking to a bird,['video9734'],"['video7029', 'video7223', 'video7378', 'video7548', 'video7698', 'video7798', 'video7820', 'video8265', 'video8268', 'video8318', 'video8330', 'video8655', 'video8781', 'video9029', 'video9231', 'video9232', 'video9510', 'video9580', 'video9772', 'video9790', 'video9803', 'video9825']",video9734,a cartoon shows two dogs talking to a bird
374,a woman talks about horse racing,['video8329'],"['video7545', 'video7574', 'video7786', 'video7836', 'video7968', 'video8240', 'video8327', 'video8675', 'video8804', 'video8899', 'video8903', 'video8910', 'video9018', 'video9248', 'video9258', 'video9349', 'video9512', 'video9575', 'video9577', 'video9694', 'video9791', 'video9824', 'video9839']",video8329,a woman talks about horse racing
383,man talks in front of a green bicycle,['video9809'],"['video7174', 'video7412', 'video7589', 'video7838', 'video8072', 'video8261', 'video8339', 'video8423', 'video8492', 'video8650', 'video8670', 'video8682', 'video8904', 'video8909', 'video8973', 'video9230', 'video9404', 'video9489', 'video9520', 'video9683', 'video9699', 'video9801']",video9809,man talks in front of a green bicycle
384,a man is on a cell phone while people are fighting,['video9623'],"['video7148', 'video7211', 'video7561', 'video7576', 'video7687', 'video7822', 'video8416', 'video8604', 'video8808', 'video8862', 'video8900', 'video9017', 'video9037', 'video9227', 'video9240', 'video9245', 'video9252', 'video9258', 'video9301', 'video9323', 'video9406', 'video9537', 'video9697']",video9623,a man is on a cell phone while people are fighting
388,a man is talking about appliances,['video7563'],"['video7131', 'video7154', 'video7162', 'video7207', 'video7418', 'video7566', 'video7597', 'video7682', 'video7820', 'video7946', 'video7965', 'video8332', 'video8456', 'video8483', 'video8682', 'video8741', 'video8796', 'video8830', 'video9221', 'video9246', 'video9404', 'video9530', 'video9620', 'video9692', 'video9779', 'video9816', 'video9819']",video7563,a man is talking about appliances
389,space explorers in red and silver suits float about in a black abyss filled with blue crystals,['video8674'],"['video7061', 'video7506', 'video7562', 'video7669', 'video7701', 'video8071', 'video8266', 'video8337', 'video8426', 'video8468', 'video8677', 'video8921', 'video9336', 'video9450', 'video9609', 'video9620', 'video9647', 'video9682', 'video9744', 'video9807']",video8674,space explorers in red and silver suits float about in a black abyss filled with blue crystals
392,a girl in black color dress wearing cloth sleeping and smoking and peeping into hole displaying on screen,['video8392'],"['video7116', 'video7144', 'video7154', 'video7362', 'video7374', 'video7413', 'video7571', 'video7598', 'video7615', 'video7947', 'video7968', 'video8073', 'video8120', 'video8240', 'video8305', 'video8314', 'video8618', 'video8675', 'video8866', 'video8899', 'video8902', 'video8903', 'video9018', 'video9252', 'video9782']",video8392,a girl in black color dress wearing cloth sleeping and smoking and peeping into hole displaying on screen
394,a man is swimming in the swimming pool,['video7797'],"['video7025', 'video7061', 'video7177', 'video7438', 'video7730', 'video8242', 'video8302', 'video8481', 'video8660', 'video8821', 'video8949', 'video9016', 'video9033', 'video9038', 'video9203', 'video9240', 'video9307', 'video9521', 'video9578', 'video9790', 'video9791', 'video9830']",video7797,a man is swimming in the swimming pool
397,article about nasa s johnson space center being broadcasted on news,['video7577'],"['video7027', 'video7119', 'video7212', 'video7219', 'video7431', 'video7562', 'video7900', 'video8069', 'video8315', 'video8668', 'video8727', 'video8829', 'video8927', 'video8935', 'video9248', 'video9330', 'video9549', 'video9605', 'video9620', 'video9805', 'video9807', 'video9820', 'video9829']",video7577,article about nasa s johnson space center being broadcasted on news
398,showing anushka sharma bollywood actress,['video8999'],"['video7144', 'video7168', 'video7356', 'video7546', 'video7588', 'video7610', 'video7799', 'video8324', 'video8453', 'video8485', 'video8628', 'video8912', 'video8919', 'video8936', 'video8974', 'video9010', 'video9019', 'video9201', 'video9225', 'video9329', 'video9513']",video8999,showing anushka sharma bollywood actress
404,a man getting interviewed by a beach,['video7589'],"['video7025', 'video7159', 'video7215', 'video7341', 'video7681', 'video7704', 'video7969', 'video8319', 'video8333', 'video8620', 'video8721', 'video8895', 'video9202', 'video9251', 'video9254', 'video9359', 'video9503', 'video9512', 'video9530', 'video9578', 'video9742', 'video9807', 'video9885']",video7589,a man getting interviewed by a beach
406,flight is shaken and the pilots trying to land the flight while they opened the air,['video7793'],"['video7028', 'video7206', 'video7233', 'video7375', 'video7558', 'video7757', 'video7792', 'video8056', 'video8071', 'video8125', 'video8441', 'video8492', 'video8679', 'video8687', 'video8792', 'video9063', 'video9247', 'video9353', 'video9514', 'video9580', 'video9609', 'video9680', 'video9698', 'video9772', 'video9774', 'video9778']",video7793,flight is shaken and the pilots trying to land the flight while they opened the air
415,a group of actors sit in a control room and think about their next move together,['video8821'],"['video7115', 'video7233', 'video7360', 'video7464', 'video7573', 'video7576', 'video8012', 'video8061', 'video8315', 'video8420', 'video8681', 'video8786', 'video8788', 'video8800', 'video8808', 'video8861', 'video8905', 'video9235', 'video9520', 'video9600', 'video9625', 'video9728', 'video9811', 'video9833']",video8821,a group of actors sit in a control room and think about their next move together
420,a woman talking about a white tank top,['video9250'],"['video7114', 'video7162', 'video7179', 'video7216', 'video7227', 'video7464', 'video7573', 'video7684', 'video7710', 'video7836', 'video8306', 'video8481', 'video8514', 'video8669', 'video8786', 'video8827', 'video8864', 'video8904', 'video9235', 'video9600', 'video9625', 'video9698', 'video9728', 'video9811', 'video9822']",video9250,a woman talking about a white tank top
423,a trailer for a movie with a girl knocking on the wall,['video9012'],"['video7064', 'video7118', 'video7214', 'video7223', 'video7370', 'video7580', 'video7699', 'video7782', 'video7799', 'video7914', 'video8263', 'video8340', 'video8392', 'video8832', 'video8839', 'video8902', 'video9237', 'video9239', 'video9330', 'video9451', 'video9549', 'video9575', 'video9691', 'video9784', 'video9816']",video9012,a trailer for a movie with a girl knocking on the wall
425,a crowd of people sitting next to each other as one man plays a video game,['video9909'],"['video7035', 'video7175', 'video7205', 'video7214', 'video7444', 'video7545', 'video7685', 'video7914', 'video7970', 'video8116', 'video8259', 'video8329', 'video8472', 'video8622', 'video8689', 'video9244', 'video9252', 'video9341', 'video9537', 'video9691', 'video9745', 'video9815', 'video9818', 'video9885']",video9909,a crowd of people sitting next to each other as one man plays a video game
428,a man is talking about the making of the movie avatar,['video8071'],"['video7176', 'video7215', 'video7418', 'video7546', 'video7649', 'video7698', 'video7731', 'video8111', 'video8265', 'video8828', 'video8912', 'video9036', 'video9236', 'video9350', 'video9406', 'video9517', 'video9537', 'video9780', 'video9825', 'video9831', 'video9885']",video8071,a man is talking about the making of the movie avatar
432,late night sneak peek preview,['video7159'],"['video7137', 'video7349', 'video7359', 'video7362', 'video7364', 'video7418', 'video7501', 'video7588', 'video7686', 'video7754', 'video7780', 'video8011', 'video8466', 'video8482', 'video8774', 'video8813', 'video8835', 'video8913', 'video8930', 'video8932', 'video9017', 'video9019', 'video9037', 'video9227', 'video9744', 'video9837']",video7159,late night sneak peek preview
435,a hairdresser and client speak to each other with kid voices,['video8918'],"['video7166', 'video7179', 'video7365', 'video7573', 'video7796', 'video7825', 'video8068', 'video8268', 'video8681', 'video8788', 'video8817', 'video8827', 'video8904', 'video9032', 'video9238', 'video9321', 'video9327', 'video9535', 'video9728', 'video9793', 'video9828', 'video9908']",video8918,a hairdresser and client speak to each other with kid voices
436,a man is playing piano,['video8255'],"['video7156', 'video7172', 'video7205', 'video7347', 'video7598', 'video7686', 'video7834', 'video7890', 'video8069', 'video8304', 'video8466', 'video8474', 'video8475', 'video8498', 'video8651', 'video8831', 'video9026', 'video9244', 'video9245', 'video9259', 'video9304']",video8255,a man is playing piano
441,a person comes up in the hill on a orange motor bike and falls down,['video8820'],"['video7560', 'video7725', 'video7766', 'video7796', 'video8073', 'video8128', 'video8657', 'video8817', 'video8918', 'video8934', 'video9026', 'video9032', 'video9206', 'video9208', 'video9238', 'video9302', 'video9327', 'video9535', 'video9770', 'video9813', 'video9832']",video8820,a person comes up in the hill on a orange motor bike and falls down
442,the press would rather interview the most ignorant person they can find than beautiful women,['video9225'],"['video7112', 'video7162', 'video7175', 'video7214', 'video7545', 'video7799', 'video8120', 'video8259', 'video8496', 'video8604', 'video8789', 'video8803', 'video8824', 'video8839', 'video8912', 'video9031', 'video9037', 'video9204', 'video9303', 'video9330', 'video9355', 'video9512', 'video9686', 'video9689', 'video9784', 'video9885']",video9225,the press would rather interview the most ignorant person they can find than beautiful women
448,men pushing a car down assembly line,['video8901'],"['video7027', 'video7110', 'video7151', 'video7174', 'video7343', 'video7567', 'video7578', 'video7820', 'video7919', 'video8246', 'video8464', 'video8651', 'video8652', 'video8669', 'video8772', 'video8798', 'video8810', 'video8912', 'video8917', 'video9223', 'video9309', 'video9404', 'video9508', 'video9679', 'video9821', 'video9919']",video8901,men pushing a car down assembly line
450,a man and woman performing in front of judes,['video9513'],"['video7144', 'video7362', 'video7370', 'video7558', 'video7596', 'video8261', 'video8339', 'video8650', 'video8683', 'video8690', 'video8786', 'video8807', 'video8906', 'video9023', 'video9302', 'video9577', 'video9683', 'video9795', 'video9801']",video9513,a man and woman performing in front of judes
451,a woman is mixing nailpolish and putting an egg into it,['video7173'],"['video7216', 'video7552', 'video7561', 'video7756', 'video7791', 'video7826', 'video7902', 'video7909', 'video8110', 'video8320', 'video8685', 'video8774', 'video8791', 'video8824', 'video9011', 'video9022', 'video9025', 'video9131', 'video9220', 'video9304', 'video9677', 'video9684', 'video9731']",video7173,a woman is mixing nailpolish and putting an egg into it
464,a woman interviewing about her part in a protest happening in brazil,['video9205'],"['video7162', 'video7341', 'video7364', 'video7577', 'video7649', 'video7681', 'video7698', 'video7960', 'video7979', 'video8022', 'video8071', 'video8111', 'video8254', 'video8265', 'video8333', 'video8489', 'video8626', 'video8650', 'video8789', 'video9352', 'video9780', 'video9831']",video9205,a woman interviewing about her part in a protest happening in brazil
465,many potatoes get washed and move through machinery,['video9735'],"['video7154', 'video7231', 'video7368', 'video7413', 'video7571', 'video7615', 'video7726', 'video7782', 'video7837', 'video7845', 'video7913', 'video8074', 'video8120', 'video8121', 'video8129', 'video8325', 'video8443', 'video8444', 'video8493', 'video8495', 'video8727', 'video8784', 'video8866', 'video9014', 'video9131', 'video9227', 'video9356', 'video9620', 'video9824']",video9735,many potatoes get washed and move through machinery
467,a man playing a video game character that is carrying a sword and killing animals with it,['video8931'],"['video7035', 'video7143', 'video7366', 'video7596', 'video7599', 'video7698', 'video7723', 'video7919', 'video8256', 'video8313', 'video8327', 'video8330', 'video8462', 'video8663', 'video8808', 'video9029', 'video9035', 'video9339', 'video9352', 'video9406', 'video9680']",video8931,a man playing a video game character that is carrying a sword and killing animals with it
470,two snakes are shown in containers,['video7350'],"['video7110', 'video7138', 'video7204', 'video7213', 'video7466', 'video7559', 'video7572', 'video7594', 'video7910', 'video8067', 'video8078', 'video8477', 'video8489', 'video8495', 'video8572', 'video8868', 'video9302', 'video9306', 'video9326', 'video9699', 'video9834']",video7350,two snakes are shown in containers
471,still photos from the 2002 movie the pianist are shown,['video9026'],"['video7020', 'video7114', 'video7467', 'video7468', 'video7548', 'video7560', 'video7686', 'video7687', 'video7725', 'video8016', 'video8628', 'video8811', 'video8820', 'video8879', 'video9035', 'video9245', 'video9355', 'video9403', 'video9508', 'video9520', 'video9605', 'video9686', 'video9770', 'video9807', 'video9810']",video9026,still photos from the 2002 movie the pianist are shown
474,there is someone serving a crab dish,['video9309'],"['video7178', 'video7346', 'video7559', 'video7591', 'video7593', 'video7823', 'video7898', 'video7919', 'video8056', 'video8472', 'video8489', 'video8772', 'video8835', 'video8930', 'video9404', 'video9409', 'video9679', 'video9685', 'video9687']",video9309,there is someone serving a crab dish
478,a woman with a camel,['video7361'],"['video7060', 'video7141', 'video7216', 'video7235', 'video7349', 'video7364', 'video7368', 'video7568', 'video7571', 'video7682', 'video8057', 'video8128', 'video8242', 'video8257', 'video8314', 'video8317', 'video8345', 'video8392', 'video8497', 'video8507', 'video9015', 'video9200', 'video9248', 'video9339', 'video9346', 'video9416', 'video9509', 'video9830']",video7361,a woman with a camel
484,a group of people are walking a woman is talking about their culture,['video7568'],"['video7060', 'video7061', 'video7216', 'video7231', 'video7235', 'video7364', 'video7570', 'video8013', 'video8014', 'video8022', 'video8241', 'video8318', 'video8325', 'video8392', 'video8443', 'video8656', 'video8741', 'video8839', 'video8895', 'video8899', 'video9015', 'video9131', 'video9341', 'video9356', 'video9521', 'video9735', 'video9798', 'video9806', 'video9811']",video7568,a group of people are walking a woman is talking about their culture
485,a man drives a red indianapolis 500 type race car around an asphalt track,['video7219'],"['video7212', 'video7214', 'video7333', 'video7562', 'video8075', 'video8089', 'video8256', 'video8307', 'video8668', 'video8819', 'video8829', 'video8911', 'video8927', 'video8935', 'video9017', 'video9259', 'video9328', 'video9330', 'video9344', 'video9535', 'video9691']",video7219,a man drives a red indianapolis 500 type race car around an asphalt track
492,a female inside a white themed bathroom while someone else makes her makeup,['video7144'],"['video7372', 'video7571', 'video7573', 'video8261', 'video8423', 'video8488', 'video8650', 'video8690', 'video8904', 'video8906', 'video9207', 'video9302', 'video9683', 'video9698', 'video9788', 'video9795', 'video9801', 'video9809', 'video9822', 'video9834']",video7144,a female inside a white themed bathroom while someone else makes her makeup
496,batman is beating up bane in a scene from a batman movie,['video8249'],"['video7207', 'video7237', 'video7352', 'video7368', 'video7576', 'video7586', 'video7726', 'video7795', 'video7913', 'video8056', 'video8061', 'video8122', 'video8266', 'video8319', 'video8807', 'video8945', 'video9015', 'video9400', 'video9623', 'video9657', 'video9698', 'video9782']",video8249,batman is beating up bane in a scene from a batman movie
497,commercial for a service called eva which will help people find a vehicle,['video8973'],"['video7026', 'video7138', 'video7209', 'video7354', 'video7356', 'video7765', 'video8022', 'video8320', 'video8322', 'video8423', 'video8622', 'video8650', 'video8651', 'video8712', 'video8904', 'video9014', 'video9230', 'video9320', 'video9339', 'video9354', 'video9358', 'video9677', 'video9699', 'video9809']",video8973,commercial for a service called eva which will help people find a vehicle
499,man in black shirt is holding a baby upside down and talking about universal studios,['video7375'],"['video7112', 'video7169', 'video7176', 'video7214', 'video7215', 'video7347', 'video7412', 'video7418', 'video7545', 'video7576', 'video8122', 'video8259', 'video8478', 'video8480', 'video8496', 'video8665', 'video8670', 'video8682', 'video8815', 'video8927', 'video9245', 'video9320', 'video9330', 'video9404', 'video9537', 'video9549', 'video9689', 'video9788']",video7375,man in black shirt is holding a baby upside down and talking about universal studios
500,the man in the video is showing a brief viewing of how the movie is starting,['video7114'],"['video7027', 'video7352', 'video7491', 'video7576', 'video7917', 'video8061', 'video8244', 'video8253', 'video8319', 'video8618', 'video8811', 'video8830', 'video8926', 'video8974', 'video9033', 'video9323', 'video9693', 'video9742']",video7114,the man in the video is showing a brief viewing of how the movie is starting
506,a group of people are swimming in a boat a monkey is walking on the tree,['video9831'],"['video7218', 'video7461', 'video7578', 'video7649', 'video7681', 'video7731', 'video8025', 'video8071', 'video8079', 'video8118', 'video8307', 'video8669', 'video8810', 'video8912', 'video8949', 'video9342', 'video9503', 'video9537', 'video9772', 'video9780', 'video9807', 'video9873']",video9831,a group of people are swimming in a boat a monkey is walking on the tree
507,person straightening out string of magnets and wrapping them around his finger,['video7560'],"['video7115', 'video7166', 'video7227', 'video7363', 'video7543', 'video7573', 'video8601', 'video8620', 'video8712', 'video8774', 'video8786', 'video8864', 'video9032', 'video9321', 'video9327', 'video9329', 'video9349', 'video9600', 'video9699', 'video9728', 'video9770', 'video9808', 'video9828']",video7560,person straightening out string of magnets and wrapping them around his finger
509,a cartoon on a young guy cursing,['video8486'],"['video7026', 'video7029', 'video7160', 'video7222', 'video7577', 'video7741', 'video8076', 'video8245', 'video8261', 'video8262', 'video8316', 'video8683', 'video8906', 'video8919', 'video8937', 'video9207', 'video9300', 'video9305', 'video9332', 'video9452', 'video9489', 'video9537', 'video9577', 'video9790']",video8486,a cartoon on a young guy cursing
511,a group of people are singing while holding coke in their hands,['video8014'],"['video7028', 'video7176', 'video7227', 'video7367', 'video7725', 'video7726', 'video7962', 'video8013', 'video8048', 'video8318', 'video8416', 'video8461', 'video8469', 'video8492', 'video8494', 'video8676', 'video8792', 'video8978', 'video9220', 'video9234', 'video9347', 'video9356', 'video9405', 'video9409', 'video9600', 'video9832', 'video9833']",video8014,a group of people are singing while holding coke in their hands
516,a girl explains about some studies showing some hands actions,['video7577'],"['video7144', 'video7216', 'video7231', 'video7580', 'video8075', 'video8254', 'video8261', 'video8307', 'video8314', 'video8650', 'video8683', 'video8712', 'video8869', 'video8906', 'video8973', 'video9302', 'video9305', 'video9344', 'video9419', 'video9503', 'video9698', 'video9699', 'video9770']",video7577,a girl explains about some studies showing some hands actions
518,a man is trying some sushi,['video7559'],"['video7215', 'video7418', 'video7570', 'video7910', 'video7972', 'video8013', 'video8014', 'video8245', 'video8301', 'video8302', 'video8323', 'video8342', 'video8456', 'video8492', 'video8868', 'video9202', 'video9229', 'video9309', 'video9327', 'video9348', 'video9537', 'video9539']",video7559,a man is trying some sushi
520,a man talks about kim chi to a camera,['video8302'],"['video7366', 'video7375', 'video7412', 'video7438', 'video7559', 'video7755', 'video7967', 'video8242', 'video8462', 'video8796', 'video8949', 'video9038', 'video9203', 'video9327', 'video9345', 'video9350', 'video9511', 'video9521', 'video9620', 'video9688', 'video9885']",video8302,a man talks about kim chi to a camera
522,a man explain why he uses edible blooms for gifts,['video7566'],"['video7113', 'video7164', 'video7201', 'video7213', 'video7372', 'video7564', 'video7849', 'video7909', 'video8317', 'video8480', 'video8686', 'video8784', 'video8816', 'video8825', 'video8906', 'video9337', 'video9404', 'video9576', 'video9752', 'video9771', 'video9821']",video7566,a man explain why he uses edible blooms for gifts
524,animated comic scene of guy cutting up food for dinner,['video9537'],"['video7111', 'video7205', 'video7214', 'video7222', 'video7365', 'video7545', 'video7574', 'video7741', 'video7914', 'video8122', 'video8268', 'video8329', 'video8655', 'video8665', 'video8911', 'video9244', 'video9258', 'video9300', 'video9341', 'video9349', 'video9580', 'video9815', 'video9818']",video9537,animated comic scene of guy cutting up food for dinner
525,kids feeding and playing with the horse,['video9451'],"['video7116', 'video7361', 'video7545', 'video7615', 'video7947', 'video8120', 'video8240', 'video8242', 'video8305', 'video8327', 'video8473', 'video8661', 'video8815', 'video8866', 'video8903', 'video8910', 'video9248', 'video9357', 'video9416', 'video9577', 'video9694', 'video9839']",video9451,kids feeding and playing with the horse
527,a woman feeds another,['video8345'],"['video7141', 'video7349', 'video7372', 'video7500', 'video7682', 'video7695', 'video7755', 'video7837', 'video7900', 'video8048', 'video8326', 'video8604', 'video8653', 'video8684', 'video8805', 'video8807', 'video8836', 'video9011', 'video9225', 'video9337', 'video9693']",video8345,a woman feeds another
529,a person folds a paper airplane,['video8688'],"['video7363', 'video7415', 'video7418', 'video7829', 'video8256', 'video8302', 'video8601', 'video8606', 'video8620', 'video8664', 'video8784', 'video8814', 'video8822', 'video8908', 'video8910', 'video8911', 'video8932', 'video9301', 'video9330', 'video9331', 'video9349', 'video9697', 'video9770', 'video9806', 'video9820', 'video9824', 'video9975']",video8688,a person folds a paper airplane
531,a man looks at the battery of a computer,['video7064'],"['video7110', 'video7215', 'video7347', 'video7350', 'video7369', 'video7559', 'video7910', 'video7913', 'video8245', 'video8319', 'video8472', 'video8492', 'video8626', 'video8682', 'video8789', 'video8804', 'video8868', 'video8924', 'video9202', 'video9348', 'video9512', 'video9530']",video7064,a man looks at the battery of a computer
533,a woman in a yellow top is holding a red drink,['video8471'],"['video7114', 'video7231', 'video7342', 'video7376', 'video7549', 'video7570', 'video7836', 'video8116', 'video8260', 'video8328', 'video8349', 'video8442', 'video8783', 'video8787', 'video8816', 'video8863', 'video8899', 'video8999', 'video9119', 'video9682', 'video9824']",video8471,a woman in a yellow top is holding a red drink
