video_id,frame_path,frame_id,sentence
video8469,./1k_frames_single/video8469.jpg,video8469,two parrots in a bird cage one white chick and on green adult
video8868,./1k_frames_single/video8868.jpg,video8868,a young girl sits in a room and looks into a bag
video8316,./1k_frames_single/video8316.jpg,video8316,a man is talking to an athlete
video7209,./1k_frames_single/video7209.jpg,video7209,someone is showing a car features
video7140,./1k_frames_single/video7140.jpg,video7140,someone is adding ingredients for a batter
video8241,./1k_frames_single/video8241.jpg,video8241,several women in pink outfits and various other styles are standing and smiling
video9301,./1k_frames_single/video9301.jpg,video9301,how to make a galaxy fighter
video7963,./1k_frames_single/video7963.jpg,video7963,a machine drills holes in a section of metal piping
video8830,./1k_frames_single/video8830.jpg,video8830,this is a video of a confrence
video9320,./1k_frames_single/video9320.jpg,video9320,a blonde man lies on a bed with a little baby
video8331,./1k_frames_single/video8331.jpg,video8331,a man teaching students in class
video7027,./1k_frames_single/video7027.jpg,video7027,the man in the video is showing a brief viewing of how the movie is starting
video9450,./1k_frames_single/video9450.jpg,video9450,a foreign military themed show
video9334,./1k_frames_single/video9334.jpg,video9334,in game footage of a mine craft character walking up stairs
video8835,./1k_frames_single/video8835.jpg,video8835,a woman serves a bowl of soup woth stuff in it
video8016,./1k_frames_single/video8016.jpg,video8016,a dog and a cat are in a standoff
video8309,./1k_frames_single/video8309.jpg,video8309,there is a wrestling match
video8910,./1k_frames_single/video8910.jpg,video8910,adding ingredients to a pizza
video9514,./1k_frames_single/video9514.jpg,video9514,inside of a toyota car with large space and safety
video9400,./1k_frames_single/video9400.jpg,video9400,someone is playing a game
video9579,./1k_frames_single/video9579.jpg,video9579,two men talk with children s voices
video8334,./1k_frames_single/video8334.jpg,video8334,a cartoon of a dog running and howling
video7358,./1k_frames_single/video7358.jpg,video7358,it is a vine compilation
video7410,./1k_frames_single/video7410.jpg,video7410,vladmir putin talks on the news about the fight against terrorism
video8443,./1k_frames_single/video8443.jpg,video8443,valencia vesus hokit in a wrestling match
video7345,./1k_frames_single/video7345.jpg,video7345,a man is talking about making it easier for kids to learn while scenes of a school are shown
video7961,./1k_frames_single/video7961.jpg,video7961,a band of singers and guitarists are performing on stage
video9343,./1k_frames_single/video9343.jpg,video9343,woman is slicing the vegetables and decorating the meal
video9037,./1k_frames_single/video9037.jpg,video9037,a women is sitting with her baby and two people talking about that
video7754,./1k_frames_single/video7754.jpg,video7754,this is a video of a live tv show
video7217,./1k_frames_single/video7217.jpg,video7217,a woman is advertising a stroller
video9237,./1k_frames_single/video9237.jpg,video9237,preview for the movie insidious
video7207,./1k_frames_single/video7207.jpg,video7207,young men discuss and demonstrate a video game
video7355,./1k_frames_single/video7355.jpg,video7355,a hand print is outlined within the silhouette of a green dinosaur shape for a movie promotion
video8423,./1k_frames_single/video8423.jpg,video8423,a female inside a white themed bathroom while someone else makes her makeup
video9204,./1k_frames_single/video9204.jpg,video9204,a news reporter talks about a shooting
video9782,./1k_frames_single/video9782.jpg,video9782,a man talking about a womans genital problems
video8667,./1k_frames_single/video8667.jpg,video8667,music is playing and advertisements was showing
video7589,./1k_frames_single/video7589.jpg,video7589,a man getting interviewed by a beach
video9404,./1k_frames_single/video9404.jpg,video9404,a lady talks into a megaphone
video9698,./1k_frames_single/video9698.jpg,video9698,a women is talking about the books she likes and the second favourite one is the amc the walking dead
video9682,./1k_frames_single/video9682.jpg,video9682,a girl being surprised with a stuffed animal by male friend
video8341,./1k_frames_single/video8341.jpg,video8341,cartoon characters are talking to a pokemon
video9246,./1k_frames_single/video9246.jpg,video9246,a beautiful sceneary is shown and the sight seeing through the train is amazing and place is so lovely to watch
video7574,./1k_frames_single/video7574.jpg,video7574,minecraft zombie kills player and takes heart
video8263,./1k_frames_single/video8263.jpg,video8263,a man drives aroud curves through a wooden mountainside
video8498,./1k_frames_single/video8498.jpg,video8498,delicious and colorful food is in the bowl
video9833,./1k_frames_single/video9833.jpg,video9833,airport security figure explains requirements for transporting medicines
video8340,./1k_frames_single/video8340.jpg,video8340,a man and a woman stand in a bedroom
video7179,./1k_frames_single/video7179.jpg,video7179,two animated woman s are talking to eachother
video8924,./1k_frames_single/video8924.jpg,video8924,a man works on a computer s motherboard
video8822,./1k_frames_single/video8822.jpg,video8822,newscasters speak about a school shooting on the news program info wars
video8048,./1k_frames_single/video8048.jpg,video8048,george lopez s family sits down for dinner
video7798,./1k_frames_single/video7798.jpg,video7798,dogs and cats playing in a park
video7820,./1k_frames_single/video7820.jpg,video7820,a guy talks about how a car s alternator wasn t working
video7560,./1k_frames_single/video7560.jpg,video7560,person straightening out string of magnets and wrapping them around his finger
video8899,./1k_frames_single/video8899.jpg,video8899,some people cross a street in a busy road
video9825,./1k_frames_single/video9825.jpg,video9825,an intelligent man with glasses talk about certain phrenologists
video7580,./1k_frames_single/video7580.jpg,video7580,a woman speaking about scifi and fantasy disasters
video9871,./1k_frames_single/video9871.jpg,video9871,bearded guy in grey tshirt talking to the camera
video8442,./1k_frames_single/video8442.jpg,video8442,a person covers a popular song
video9788,./1k_frames_single/video9788.jpg,video9788,a woman with long white hair and dressed all in white is sailing through the sky over snow covered ground
video7565,./1k_frames_single/video7565.jpg,video7565,in a kitchen a woman is chopping tomatoes in a food processor
video8025,./1k_frames_single/video8025.jpg,video8025,the opeing credit to gullah grub authentic cooking
video9406,./1k_frames_single/video9406.jpg,video9406,a person giving his opinion on how crowded the world is
video9359,./1k_frames_single/video9359.jpg,video9359,pictures of a beach while a voice talks about a shark attack
video8339,./1k_frames_single/video8339.jpg,video8339,kids in a circle play with beach ball and surf boards
video7478,./1k_frames_single/video7478.jpg,video7478,a football video game is being played
video7833,./1k_frames_single/video7833.jpg,video7833,a man is talking about business
video9835,./1k_frames_single/video9835.jpg,video9835,the women sit at the lap top and talk to one another
video8756,./1k_frames_single/video8756.jpg,video8756,a woman is dressed up in face paint
video8829,./1k_frames_single/video8829.jpg,video8829,two men talk about stealing land and the bible
video9821,./1k_frames_single/video9821.jpg,video9821,a man giving a presentation and showing the planet earth
video7554,./1k_frames_single/video7554.jpg,video7554,a person pointing to food on a plate
video8125,./1k_frames_single/video8125.jpg,video8125,a man in a flying contraption crashes in a field
video7688,./1k_frames_single/video7688.jpg,video7688,one of two guys walking on a carton of eggs with bare feet
video7914,./1k_frames_single/video7914.jpg,video7914,a flower and other natural scenes are displaying
video8479,./1k_frames_single/video8479.jpg,video8479,a woman demonstrates how to cook chitlins
video8420,./1k_frames_single/video8420.jpg,video8420,a man sits in a large black truck adjusting mirror
video8913,./1k_frames_single/video8913.jpg,video8913,a video about different sports
video9802,./1k_frames_single/video9802.jpg,video9802,a woman dances in the background while a guy doesn t move
video8315,./1k_frames_single/video8315.jpg,video8315,three men were discussing the national football league
video9805,./1k_frames_single/video9805.jpg,video9805,characters from video games are dancing to old mc donald had a farm
video7919,./1k_frames_single/video7919.jpg,video7919,a character is jumping and floating in the air in a video game
video9321,./1k_frames_single/video9321.jpg,video9321,penguins wander around on ice
video7215,./1k_frames_single/video7215.jpg,video7215,person playing a game
video7113,./1k_frames_single/video7113.jpg,video7113,a child in pink watches a white bird in an open box
video7909,./1k_frames_single/video7909.jpg,video7909,a woman holding a ribbon
video7765,./1k_frames_single/video7765.jpg,video7765,a person is discussing a car
video8264,./1k_frames_single/video8264.jpg,video8264,women athletes taking their positions for a running race
video8672,./1k_frames_single/video8672.jpg,video8672,dog is drinking milk with baby nibble bottle
video9330,./1k_frames_single/video9330.jpg,video9330,a man with a guitar sings on a farm
video7977,./1k_frames_single/video7977.jpg,video7977,someone is drawing pictures
video7500,./1k_frames_single/video7500.jpg,video7500,a soccer team walking out on the field
video9238,./1k_frames_single/video9238.jpg,video9238,a man is singing and dancing in an elevator while people watch
video8258,./1k_frames_single/video8258.jpg,video8258,woman is using a baby stroller
video8321,./1k_frames_single/video8321.jpg,video8321,a man is talking about something
video9251,./1k_frames_single/video9251.jpg,video9251,sleeping beauty play promotion
video7024,./1k_frames_single/video7024.jpg,video7024,little pet shop cat getting a bath and washed with little brush
video9832,./1k_frames_single/video9832.jpg,video9832,a video game character rides around on a motorcycle
video9451,./1k_frames_single/video9451.jpg,video9451,kids feeding and playing with the horse
video8836,./1k_frames_single/video8836.jpg,video8836,a woman is cooking food and a man is setting a table
video7360,./1k_frames_single/video7360.jpg,video7360,a woman is showing shrimp and bunch of different other ingredients in order to cook a dish
video9019,./1k_frames_single/video9019.jpg,video9019,two people playing basketball and the one with a hat makes every shot
video9745,./1k_frames_single/video9745.jpg,video9745,a man is wearing a cap
video8343,./1k_frames_single/video8343.jpg,video8343,a man is holding a coffee mug
video8470,./1k_frames_single/video8470.jpg,video8470,high school wrestling match
video8256,./1k_frames_single/video8256.jpg,video8256,someone playing the game dark souls
video7900,./1k_frames_single/video7900.jpg,video7900,a man talks about dna force
video9351,./1k_frames_single/video9351.jpg,video9351,a man is singing on stage to a huge audience he is holding a microphone
video9335,./1k_frames_single/video9335.jpg,video9335,the person is frying the prawns and fish
video7211,./1k_frames_single/video7211.jpg,video7211,people share their thoughts on a boxing match
video7783,./1k_frames_single/video7783.jpg,video7783,long legged woman with black clothes is walking on the scene
video7143,./1k_frames_single/video7143.jpg,video7143,someone giving demo for some game
video9735,./1k_frames_single/video9735.jpg,video9735,many potatoes get washed and move through machinery
video7571,./1k_frames_single/video7571.jpg,video7571,a woman in black puts on blush while looking in a mirror
video8302,./1k_frames_single/video8302.jpg,video8302,a man talks about kim chi to a camera
video7438,./1k_frames_single/video7438.jpg,video7438,the articles of a shop is being shown
video8864,./1k_frames_single/video8864.jpg,video8864,a clip from fox news on the shelby north carolina shooting
video7231,./1k_frames_single/video7231.jpg,video7231,a woman introducing someone
video7970,./1k_frames_single/video7970.jpg,video7970,two child playing in the house
video7898,./1k_frames_single/video7898.jpg,video7898,a salad in a bowl is being filmed on a table
video9731,./1k_frames_single/video9731.jpg,video9731,a woman is mixing food in a mixing bowl
video8806,./1k_frames_single/video8806.jpg,video8806,someone looking at a japanese book
video7431,./1k_frames_single/video7431.jpg,video7431,a man talks about the publication of a nasa technical report
video9015,./1k_frames_single/video9015.jpg,video9015,several enormous juicy burgers are all stacked together
video9243,./1k_frames_single/video9243.jpg,video9243,they are singing a song and playing a guitar in the stage
video7577,./1k_frames_single/video7577.jpg,video7577,a girl explains about some studies showing some hands actions
video9305,./1k_frames_single/video9305.jpg,video9305,a football match between usa and japan
video7176,./1k_frames_single/video7176.jpg,video7176,a man is talking about space project adam
video9234,./1k_frames_single/video9234.jpg,video9234,two men walking and talking about the road
video7788,./1k_frames_single/video7788.jpg,video7788,two guys are wrestling in a competition
video7733,./1k_frames_single/video7733.jpg,video7733,a child is singing on stage
video7169,./1k_frames_single/video7169.jpg,video7169,a female nurse washes her hands and then cleans off a surface
video8914,./1k_frames_single/video8914.jpg,video8914,models are walking down a short runway
video9307,./1k_frames_single/video9307.jpg,video9307,the lady came their room go to the kitchen try to make their food
video7350,./1k_frames_single/video7350.jpg,video7350,two snakes are shown in containers
video7544,./1k_frames_single/video7544.jpg,video7544,a car goes racing down the road
video7829,./1k_frames_single/video7829.jpg,video7829,someone is putting a skeleton slide on a projector
video7693,./1k_frames_single/video7693.jpg,video7693,this is a jigsaw puzzle video
video7112,./1k_frames_single/video7112.jpg,video7112,while other friends too try and hitting the basket another is eager to achieve his fourth successful basket in basketball
video9018,./1k_frames_single/video9018.jpg,video9018,people scoring in sports videos
video8482,./1k_frames_single/video8482.jpg,video8482,late night sneak peek preview
video8930,./1k_frames_single/video8930.jpg,video8930,a man speaks on a a news panel
video9011,./1k_frames_single/video9011.jpg,video9011,a woman in black dress and a man in a black suit sits together
video9472,./1k_frames_single/video9472.jpg,video9472,a girl wearing a dress stands to the side of the screen while lyrics to a song playing in the background appear on the other side
video8816,./1k_frames_single/video8816.jpg,video8816,animated cartoon character is catching the ball
video7200,./1k_frames_single/video7200.jpg,video7200,a female soccer player accepts a reward while being cheered on by the crowd
video7581,./1k_frames_single/video7581.jpg,video7581,lyrics are written for the song
video7973,./1k_frames_single/video7973.jpg,video7973,someone is frying food
video9576,./1k_frames_single/video9576.jpg,video9576,a movie scene little boys inside water flowing inside forest displaying on screen
video9535,./1k_frames_single/video9535.jpg,video9535,a man is talking about a sports car he is driving
video9013,./1k_frames_single/video9013.jpg,video9013,basketball highlights of players scoring
video8266,./1k_frames_single/video8266.jpg,video8266,a robot is seen in a movie preview
video9811,./1k_frames_single/video9811.jpg,video9811,a group of actors sit in a control room and think about their next move together
video9010,./1k_frames_single/video9010.jpg,video9010,a group of zombis walking towards a very tall building with a globe in front of it
video7234,./1k_frames_single/video7234.jpg,video7234,a woman flanked by two men are with a discussion
video8865,./1k_frames_single/video8865.jpg,video8865,a man in a kitchen is preparing pancakes he s wearing a white shirt and has black hair
video7501,./1k_frames_single/video7501.jpg,video7501,will smith has starred in a lot of movies including the movie ali
video9600,./1k_frames_single/video9600.jpg,video9600,handsome man plays guitar and sings
video7061,./1k_frames_single/video7061.jpg,video7061,goldfish chase each other around a blue tank to music
video9331,./1k_frames_single/video9331.jpg,video9331,a man drives his car down the road
video8347,./1k_frames_single/video8347.jpg,video8347,a video of someone talking about some girls
video7168,./1k_frames_single/video7168.jpg,video7168,he is playing with ball
video8923,./1k_frames_single/video8923.jpg,video8923,women are modeling clothes
video7827,./1k_frames_single/video7827.jpg,video7827,people are walking down a street holding signs
video7598,./1k_frames_single/video7598.jpg,video7598,a person is singing in a studio
video8797,./1k_frames_single/video8797.jpg,video8797,guys playing minecraft
video7724,./1k_frames_single/video7724.jpg,video7724,a lady describes about workout and exercises for women
video9816,./1k_frames_single/video9816.jpg,video9816,a little girl talking to her and is scared
video7849,./1k_frames_single/video7849.jpg,video7849,a red haired woman holds a green parrot near shelves filled with bird food
video8677,./1k_frames_single/video8677.jpg,video8677,two mermaid with red hair is sitting on a rock
video8348,./1k_frames_single/video8348.jpg,video8348,a woman looks after abandoned children for free in her home
video8826,./1k_frames_single/video8826.jpg,video8826,lady speaking on her show
video7506,./1k_frames_single/video7506.jpg,video7506,a video game car is driving recklessly
video7910,./1k_frames_single/video7910.jpg,video7910,a man looks at the battery of a computer
video7710,./1k_frames_single/video7710.jpg,video7710,a man playing video games
video7341,./1k_frames_single/video7341.jpg,video7341,in an interview a person in advocating education among the populace
video7363,./1k_frames_single/video7363.jpg,video7363,a man loads a clip into a pistol
video7206,./1k_frames_single/video7206.jpg,video7206,a helicopter is shown flying in what seems to be a war zone in syria
video9338,./1k_frames_single/video9338.jpg,video9338,a girl digging in the sand
video9778,./1k_frames_single/video9778.jpg,video9778,a little boy singing in front of judges and crowd
video9804,./1k_frames_single/video9804.jpg,video9804,a display of clips of the movie there will be blood
video7115,./1k_frames_single/video7115.jpg,video7115,a man is showing off a new vehicle
video8751,./1k_frames_single/video8751.jpg,video8751,a person is doing cooking show and telling the ingredients
video8077,./1k_frames_single/video8077.jpg,video8077,a man playing a video game
video8834,./1k_frames_single/video8834.jpg,video8834,a man is cooking in the kitchen he states he will return later to add to the dish
video9358,./1k_frames_single/video9358.jpg,video9358,someone is talking about a car
video9256,./1k_frames_single/video9256.jpg,video9256,a woman is making playdoh
video8323,./1k_frames_single/video8323.jpg,video8323,a cat is layingon a couch and another islaying in a basket
video7216,./1k_frames_single/video7216.jpg,video7216,a woman giving skin care tips
video9784,./1k_frames_single/video9784.jpg,video9784,sygornie weaver pointing a gun and then running
video7152,./1k_frames_single/video7152.jpg,video7152,a person is swimming in some white water rapids
video7566,./1k_frames_single/video7566.jpg,video7566,a man explain why he uses edible blooms for gifts
video8252,./1k_frames_single/video8252.jpg,video8252,bride standing with a old man in formal wear
video9355,./1k_frames_single/video9355.jpg,video9355,a person describing a recording of a video game
video8790,./1k_frames_single/video8790.jpg,video8790,two women are embracing
video7832,./1k_frames_single/video7832.jpg,video7832,a man and woman looking at each other on the subway
video8319,./1k_frames_single/video8319.jpg,video8319,there is a man in black is walking in to the bridge
video8789,./1k_frames_single/video8789.jpg,video8789,a girl in blue color dress wearing siting speaking and television screen with black shirt man beside still image displaying on screen
video8681,./1k_frames_single/video8681.jpg,video8681,a young man and his dad are rubbing each other s hair it s a commercial for vodafone
video7610,./1k_frames_single/video7610.jpg,video7610,the olympics wight lifting photo is illustrated to explain gravitational force
video8684,./1k_frames_single/video8684.jpg,video8684,a person points out certain figures on a paper
video9683,./1k_frames_single/video9683.jpg,video9683,a man and woman performing in front of judes
video7831,./1k_frames_single/video7831.jpg,video7831,a young girl is abusing a young man
video7836,./1k_frames_single/video7836.jpg,video7836,a girl with a hat on and dancing
video7786,./1k_frames_single/video7786.jpg,video7786,a song with skeletons dancing
video9790,./1k_frames_single/video9790.jpg,video9790,squidward scenes playing with a lil wayne song
video9259,./1k_frames_single/video9259.jpg,video9259,a car of 1970 is on the screen
video7362,./1k_frames_single/video7362.jpg,video7362,a person is cooking on stage
video9824,./1k_frames_single/video9824.jpg,video9824,two ladies sitting down and talking in an office room
video7681,./1k_frames_single/video7681.jpg,video7681,a group of people are riding on a raft in a body of water
video7466,./1k_frames_single/video7466.jpg,video7466,a group of men carry a body covered in a sheet
video8011,./1k_frames_single/video8011.jpg,video8011,a girl talks about photos and her life
video9836,./1k_frames_single/video9836.jpg,video9836,a woman is stirring food
video7972,./1k_frames_single/video7972.jpg,video7972,a man shows how a video game works
video8250,./1k_frames_single/video8250.jpg,video8250,instructional video on home improvement subjects
video7835,./1k_frames_single/video7835.jpg,video7835,two cartoon characters walking underwater
video9303,./1k_frames_single/video9303.jpg,video9303,children singing a song as a group on a stage
video9742,./1k_frames_single/video9742.jpg,video9742,the actor playing thor talking about the new movie
video8251,./1k_frames_single/video8251.jpg,video8251,guy in tshirt playing guitar and singing song
video9230,./1k_frames_single/video9230.jpg,video9230,a man talks to a little boy about not letting people convince him that anything he wants to do in life isn t possible
video9975,./1k_frames_single/video9975.jpg,video9975,a yellow sports car with a guy speaking about the car
video7915,./1k_frames_single/video7915.jpg,video7915,a man in sunglasses and a blue shirt beat boxes
video9837,./1k_frames_single/video9837.jpg,video9837,video game footage of a killing spree during call of duty black ops
video8012,./1k_frames_single/video8012.jpg,video8012,a woman jumps over a bar and attacks a man
video7346,./1k_frames_single/video7346.jpg,video7346,some people video conferencing as they watch a movie
video7351,./1k_frames_single/video7351.jpg,video7351,a man is acting out a scene
video9524,./1k_frames_single/video9524.jpg,video9524,a bunch of cartoon faces are chomping their teeth and making eating gestures
video8061,./1k_frames_single/video8061.jpg,video8061,comedy skit with dc comics character vane
video9791,./1k_frames_single/video9791.jpg,video9791,a woman talking about different pictures next to her
video8780,./1k_frames_single/video8780.jpg,video8780,some people are shooting outside
video8867,./1k_frames_single/video8867.jpg,video8867,the house has at least three small pets
video8445,./1k_frames_single/video8445.jpg,video8445,people enjoy the performance of singer
video8683,./1k_frames_single/video8683.jpg,video8683,two people welcome people to an episode of their show
video9830,./1k_frames_single/video9830.jpg,video9830,some people was swimming under the waterit is very good job
video7969,./1k_frames_single/video7969.jpg,video7969,person driving in car
video7913,./1k_frames_single/video7913.jpg,video7913,a man describing how to do something in windows
video7845,./1k_frames_single/video7845.jpg,video7845,a person chops up lettuce and a strainer of kidney beans is shown
video9029,./1k_frames_single/video9029.jpg,video9029,a player is putting a basket ball into the basket from distance
video7549,./1k_frames_single/video7549.jpg,video7549,a transvestite shows what she bought for her dog including shampoo and conditioner made by martha stuart
video7799,./1k_frames_single/video7799.jpg,video7799,a guy chops up garlic and pours it over chicken frying in a pan
video8907,./1k_frames_single/video8907.jpg,video8907,scene of thor from the avengers
video8078,./1k_frames_single/video8078.jpg,video8078,a man in his backyard talks tot he camera and is going to skin a snake
video7795,./1k_frames_single/video7795.jpg,video7795,a documentary on how to windsurf and in particular recover from a wipeout
video7558,./1k_frames_single/video7558.jpg,video7558,two boys introducing a young lady who plays the cups and sings
video9807,./1k_frames_single/video9807.jpg,video9807,a planet is being filmed from space outside
video7791,./1k_frames_single/video7791.jpg,video7791,three kids are performing a song
video8478,./1k_frames_single/video8478.jpg,video8478,a cat is licking a baby
video7371,./1k_frames_single/video7371.jpg,video7371,a tv shows review program hosts discuss about the performance and staying on air of star trek
video9336,./1k_frames_single/video9336.jpg,video9336,video game of a truck driving through desert obstacles
video8466,./1k_frames_single/video8466.jpg,video8466,men are playing instruments in a band
video9014,./1k_frames_single/video9014.jpg,video9014,a cartoon plane picking up fruit and putting it in trucks
