video_id,frame_path,frame_id,sentence
video7579,./1k_frames_single/video7579.jpg,video7579,a girl wearing red top and black trouser is putting a sweater on a dog
video7725,./1k_frames_single/video7725.jpg,video7725,young people sit around the edges of a room clapping and raising their arms while others dance in the center during a party
video9258,./1k_frames_single/video9258.jpg,video9258,a person is using a phone
video7365,./1k_frames_single/video7365.jpg,video7365,cartoon people are eating at a restaurant
video8068,./1k_frames_single/video8068.jpg,video8068,a woman on a couch talks to a a man
video7131,./1k_frames_single/video7131.jpg,video7131,athletes are getting ready and start running for an event
video7213,./1k_frames_single/video7213.jpg,video7213,a woman is making lasagna
video7575,./1k_frames_single/video7575.jpg,video7575,a man speaking in a microphone
video7978,./1k_frames_single/video7978.jpg,video7978,a team with blue uniforms are playing badmitten with a team in white
video8123,./1k_frames_single/video8123.jpg,video8123,a woman is giving demo for baby trolley
video9800,./1k_frames_single/video9800.jpg,video9800,a car is in a wreck
video9205,./1k_frames_single/video9205.jpg,video9205,a woman interviewing about her part in a protest happening in brazil
video7590,./1k_frames_single/video7590.jpg,video7590,an emotional scene of two persons where they are crying on meeting
video9017,./1k_frames_single/video9017.jpg,video9017,the man is driving his motorbike fast and having problems on the race
video9241,./1k_frames_single/video9241.jpg,video9241,japanese people laughing and dancing
video7158,./1k_frames_single/video7158.jpg,video7158,fox news presidential debate recapping the gop debate with donald trump and ted cruz
video9233,./1k_frames_single/video9233.jpg,video9233,a man is giving a speech
video8687,./1k_frames_single/video8687.jpg,video8687,fast moving time is shown here
video9337,./1k_frames_single/video9337.jpg,video9337,some people are inside of a room
video9620,./1k_frames_single/video9620.jpg,video9620,outer space pictures that have parts of equipments in them with water droplets on it
video7411,./1k_frames_single/video7411.jpg,video7411,jolly good music troop delivering a program and the lady is in good spirit
video8514,./1k_frames_single/video8514.jpg,video8514,a person is putting the vegetable in to the water and boil it
video8481,./1k_frames_single/video8481.jpg,video8481,a woman is reporting on keds commercials
video9224,./1k_frames_single/video9224.jpg,video9224,someone is playing a game
video8426,./1k_frames_single/video8426.jpg,video8426,cabins on a sandy beach have walkways going up to their porches
video9699,./1k_frames_single/video9699.jpg,video9699,a man explains how to do a experiment
video9882,./1k_frames_single/video9882.jpg,video9882,a news reader is reading the news and asking question to some people
video8300,./1k_frames_single/video8300.jpg,video8300,a woman pours water into her pot of meat then tomato sauce and stirs it all around while talking
video8863,./1k_frames_single/video8863.jpg,video8863,an animated girl talks to a baby and plays with it
video7147,./1k_frames_single/video7147.jpg,video7147,a man cooks burgers and bacon on a grill
video7744,./1k_frames_single/video7744.jpg,video7744,a chef stirs up some ingredients inside of a pan
video7839,./1k_frames_single/video7839.jpg,video7839,this is a vine sports compilation
video7214,./1k_frames_single/video7214.jpg,video7214,race cars of different colors lined up on a dark track
video7771,./1k_frames_single/video7771.jpg,video7771,a golf player is trying to hit the ball into the pit
video8486,./1k_frames_single/video8486.jpg,video8486,a cartoon on a young guy cursing
video9909,./1k_frames_single/video9909.jpg,video9909,a crowd of people sitting next to each other as one man plays a video game
video8922,./1k_frames_single/video8922.jpg,video8922,an old man shakes hands with another man and then they hug each other
video9814,./1k_frames_single/video9814.jpg,video9814,a scene from spongebob squarepants where the townspeople are carrying torches and chasing a giant squidward
video9368,./1k_frames_single/video9368.jpg,video9368,someone demonstrates about the small motor uses to the video
video8820,./1k_frames_single/video8820.jpg,video8820,a person comes up in the hill on a orange motor bike and falls down
video9452,./1k_frames_single/video9452.jpg,video9452,an animated grey shark in the middle of a blue water simulation background rotating in a circle on the screen of a monitor
video9344,./1k_frames_single/video9344.jpg,video9344,gameplay footage of someone playing a game
video9032,./1k_frames_single/video9032.jpg,video9032,a hospital mortuary room and a doctor treat the special case
video9016,./1k_frames_single/video9016.jpg,video9016,all persons are wearing bikini dresses and playing in sea
video9353,./1k_frames_single/video9353.jpg,video9353,two women are outside and are discussing something in a foreign language
video9405,./1k_frames_single/video9405.jpg,video9405,red balloons float in the sky and have packages tied to them
video7559,./1k_frames_single/video7559.jpg,video7559,a man is trying some sushi
video9063,./1k_frames_single/video9063.jpg,video9063,people on stage performing
video7352,./1k_frames_single/video7352.jpg,video7352,a movie scene starring morgan freeman and men in armor running
video8447,./1k_frames_single/video8447.jpg,video8447,a woman singing on the voice
video8322,./1k_frames_single/video8322.jpg,video8322,a lady tries to ride on bicycle but fails
video7939,./1k_frames_single/video7939.jpg,video7939,a man and woman stand together and cook in the kitchen
video7567,./1k_frames_single/video7567.jpg,video7567,a man checks out detail on a car
video9418,./1k_frames_single/video9418.jpg,video9418,a man in black suit is talking about deforestation and about climate change
video8917,./1k_frames_single/video8917.jpg,video8917,two men discuss social issues
video7704,./1k_frames_single/video7704.jpg,video7704,a man with a very red nose
video7218,./1k_frames_single/video7218.jpg,video7218,episode from spongebob cartoon
video7028,./1k_frames_single/video7028.jpg,video7028,a man is singing and standing in the road
video8909,./1k_frames_single/video8909.jpg,video8909,list of people s involved in making the documentary
video8269,./1k_frames_single/video8269.jpg,video8269,the man thought students should be given the freedom to learn
video9354,./1k_frames_single/video9354.jpg,video9354,a red truck is burning while three men talk about a car
video8825,./1k_frames_single/video8825.jpg,video8825,a woman holds up a leather jacket
video9324,./1k_frames_single/video9324.jpg,video9324,animated video showing a bottle rolling across an empty hallway
video9403,./1k_frames_single/video9403.jpg,video9403,i see a prince trying to get a girl and i see peter pan play around
video8254,./1k_frames_single/video8254.jpg,video8254,a woman in a purple dress is talking on a video
video7148,./1k_frames_single/video7148.jpg,video7148,a cheif is preparing a treat
video7367,./1k_frames_single/video7367.jpg,video7367,this is a rock band music video
video9574,./1k_frames_single/video9574.jpg,video9574,in the ocean a man on a surfboard rides a wave
video9516,./1k_frames_single/video9516.jpg,video9516,people are cheering at a stadium
video9329,./1k_frames_single/video9329.jpg,video9329,a couple is shown
video9580,./1k_frames_single/video9580.jpg,video9580,the animals are having nice time together and eating food
video8712,./1k_frames_single/video8712.jpg,video8712,a woman is showing nail polish
video8556,./1k_frames_single/video8556.jpg,video8556,a group of people are stamp dancing on stage in front of a crowd
video9253,./1k_frames_single/video9253.jpg,video9253,people talking about their trip and how they are taken care of
video8949,./1k_frames_single/video8949.jpg,video8949,woman with swimming suit is plunging into the water and gets rid of the suit
video8119,./1k_frames_single/video8119.jpg,video8119,guy explaining what stiff person syndrome is
video7854,./1k_frames_single/video7854.jpg,video7854,a guy talks outside in the snow at a ski resort
video7110,./1k_frames_single/video7110.jpg,video7110,there is a man shooting other people in a corridor
video9605,./1k_frames_single/video9605.jpg,video9605,a special songs for the game
video8116,./1k_frames_single/video8116.jpg,video8116,a dad plays video games with his son
video7145,./1k_frames_single/video7145.jpg,video7145,a critic about wine speaks about the french wines
video7752,./1k_frames_single/video7752.jpg,video7752,a man speaks on driving and a car model
video7946,./1k_frames_single/video7946.jpg,video7946,the man sitting in the black chair and wearing brown suit is talking
video9513,./1k_frames_single/video9513.jpg,video9513,a woman is smiling
video9623,./1k_frames_single/video9623.jpg,video9623,a man is on a cell phone while people are fighting
video7412,./1k_frames_single/video7412.jpg,video7412,a man talks about visiting visiting a specific place to buy some things
video9872,./1k_frames_single/video9872.jpg,video9872,someone is playing a first person shooter game and is making jokes
video8819,./1k_frames_single/video8819.jpg,video8819,a video is shown showing different cars
video8784,./1k_frames_single/video8784.jpg,video8784,a woman makes crafts
video7467,./1k_frames_single/video7467.jpg,video7467,disney movie video clips
video8242,./1k_frames_single/video8242.jpg,video8242,miniature donkeys walking around and making noises
video8662,./1k_frames_single/video8662.jpg,video8662,a man a woman cooking on a cooking show
video9969,./1k_frames_single/video9969.jpg,video9969,two girls are sitting in the bed with a cat and talking
video8906,./1k_frames_single/video8906.jpg,video8906,bbc news story about military crackdown in an unknown asian country
video9119,./1k_frames_single/video9119.jpg,video9119,a man talks about molecules and certain types of antibodies
video7357,./1k_frames_single/video7357.jpg,video7357,tennis players are involved in matches in large stadiums in front of large crowds
video8783,./1k_frames_single/video8783.jpg,video8783,a lady named lizzy is speaking about movies she is wearing a very nice outfit
video7669,./1k_frames_single/video7669.jpg,video7669,three woman doing a fashion show to music
video9503,./1k_frames_single/video9503.jpg,video9503,a woman is talking about how jeans with patches or rips is trendy
video8262,./1k_frames_single/video8262.jpg,video8262,wrestlers are involved in a large wrestling meet
video7528,./1k_frames_single/video7528.jpg,video7528,a girl singing a song and her group were playing music
video9827,./1k_frames_single/video9827.jpg,video9827,lady gaga sings in a music video
video9249,./1k_frames_single/video9249.jpg,video9249,a man is discussing oxiders in bulk form
video8837,./1k_frames_single/video8837.jpg,video8837,a young girl petting a dog that is laying on a couch
video7964,./1k_frames_single/video7964.jpg,video7964,the couples are kissing in the game of throne
video8070,./1k_frames_single/video8070.jpg,video8070,man driving a car in a video game
video9957,./1k_frames_single/video9957.jpg,video9957,a group of people are dancing in a room
video9302,./1k_frames_single/video9302.jpg,video9302,a guy trying to climb on a rope while another guy timing him
video8655,./1k_frames_single/video8655.jpg,video8655,an animal is throwing a piece of junk
video7797,./1k_frames_single/video7797.jpg,video7797,a man is swimming in the swimming pool
video9225,./1k_frames_single/video9225.jpg,video9225,a man discusses a bollywood celebrity
video8261,./1k_frames_single/video8261.jpg,video8261,blonde woman with black nails is recording herself in a room
video8303,./1k_frames_single/video8303.jpg,video8303,a cartoon announcing the next event in a fake show
video7445,./1k_frames_single/video7445.jpg,video7445,a man is talking and playing a video game
video7753,./1k_frames_single/video7753.jpg,video7753,a man is giving his commentary on a current event television show
video7359,./1k_frames_single/video7359.jpg,video7359,two people are preparing for sports
video8013,./1k_frames_single/video8013.jpg,video8013,a video showing footage from sporting events
video9834,./1k_frames_single/video9834.jpg,video9834,old black and white films are shown and the history of motion pictures is being dealt with
video7418,./1k_frames_single/video7418.jpg,video7418,an indian man talking about iphones and a new type of clothing
video9356,./1k_frames_single/video9356.jpg,video9356,someone is arranging utensilslarge saucepan and spoons as a preparation to cook something
video7153,./1k_frames_single/video7153.jpg,video7153,there is a wrestling match going on between two people
video9750,./1k_frames_single/video9750.jpg,video9750,a man points his gun towards a woman in a room
video8818,./1k_frames_single/video8818.jpg,video8818,several young girls are singing on stage
video8057,./1k_frames_single/video8057.jpg,video8057,a women preparing a duck to roast
video9693,./1k_frames_single/video9693.jpg,video9693,the chef adds fish sauce and fish paste to a large stainless steel cooking pot
video9036,./1k_frames_single/video9036.jpg,video9036,young children in red fire chief hats are guided to a fire engine and up its metal textured stairs
video9815,./1k_frames_single/video9815.jpg,video9815,a mashup of music videos is being played
video8664,./1k_frames_single/video8664.jpg,video8664,customers wait in line at an ice cream shop while employees tend to them
video7376,./1k_frames_single/video7376.jpg,video7376,broth is being added to a soup pot and stirred with a rubber spatula
video9639,./1k_frames_single/video9639.jpg,video9639,women poring sauce to cooking vegetables
video8494,./1k_frames_single/video8494.jpg,video8494,a girl is talking about a celebrity
video9511,./1k_frames_single/video9511.jpg,video9511,a person is riding red car on road
video7563,./1k_frames_single/video7563.jpg,video7563,a man is talking about appliances
video9879,./1k_frames_single/video9879.jpg,video9879,the young performer impressed his audience
video9222,./1k_frames_single/video9222.jpg,video9222,a boy is trying out for a part on the voice kids
video9548,./1k_frames_single/video9548.jpg,video9548,a reporter asks questions at a gun range
video8349,./1k_frames_single/video8349.jpg,video8349,friends enjoy eating
video8903,./1k_frames_single/video8903.jpg,video8903,there are crocodiles about to eat the group of people walking across the water
video8915,./1k_frames_single/video8915.jpg,video8915,person cooking up somefood
video9677,./1k_frames_single/video9677.jpg,video9677,a guy wearing a red shirt drives a car while talking
video7701,./1k_frames_single/video7701.jpg,video7701,cartoon cars smiling talking and driving down a city road
video7767,./1k_frames_single/video7767.jpg,video7767,a slideshow with captions
video7785,./1k_frames_single/video7785.jpg,video7785,person lighting a kettle
video9232,./1k_frames_single/video9232.jpg,video9232,a video game woman character runs down a hill followed by a dog running down the hill they both then run up the hill together
video7150,./1k_frames_single/video7150.jpg,video7150,a picture of the batsman is shown and he is ready for the batting and the audience are watching the show
video7794,./1k_frames_single/video7794.jpg,video7794,a famous tv talk show
video9803,./1k_frames_single/video9803.jpg,video9803,two guys wrestling at an event
video9694,./1k_frames_single/video9694.jpg,video9694,a guy barbequeing potatoes
video9609,./1k_frames_single/video9609.jpg,video9609,two astronauts experiencing a tense situation before relaxing afterwards
video8945,./1k_frames_single/video8945.jpg,video8945,two men stand on a platform suspended high above the city
video8879,./1k_frames_single/video8879.jpg,video8879,a tamil movie scene is being shown they travel through a auto riksha and speak about the importance of work
video7230,./1k_frames_single/video7230.jpg,video7230,a woman is talking about a baby stroller
video9734,./1k_frames_single/video9734.jpg,video9734,a cartoon shows two dogs talking to a bird
video7594,./1k_frames_single/video7594.jpg,video7594,water is being filtered in a tank with rocks
video9244,./1k_frames_single/video9244.jpg,video9244,documentary about museum in peninsula
video7680,./1k_frames_single/video7680.jpg,video7680,an ethiopian woman asks a child what she is good at
video8620,./1k_frames_single/video8620.jpg,video8620,a woman is making a hair accessory
video8973,./1k_frames_single/video8973.jpg,video8973,commercial for a service called eva which will help people find a vehicle
video9518,./1k_frames_single/video9518.jpg,video9518,people perform on the voice
video8686,./1k_frames_single/video8686.jpg,video8686,a women is doing craft and talking about that
video8490,./1k_frames_single/video8490.jpg,video8490,the song hero by skillet with lyrics
video8781,./1k_frames_single/video8781.jpg,video8781,a song from the movie beauty and the beast
video8075,./1k_frames_single/video8075.jpg,video8075,scenes of romantic film
video8076,./1k_frames_single/video8076.jpg,video8076,a web animation of a businessman
video9577,./1k_frames_single/video9577.jpg,video9577,cartoon one women in horse and speak to that calmly
video8673,./1k_frames_single/video8673.jpg,video8673,a man discusses spongebob
video9352,./1k_frames_single/video9352.jpg,video9352,a man is talking to a crowd
video8920,./1k_frames_single/video8920.jpg,video8920,a kid unwrapping his presents
video7747,./1k_frames_single/video7747.jpg,video7747,this is a scene from a disney cartoon set in ancient times
video7468,./1k_frames_single/video7468.jpg,video7468,a man jumps onto a ledge of a building
video7756,./1k_frames_single/video7756.jpg,video7756,a group of women are singing
video7175,./1k_frames_single/video7175.jpg,video7175,the band member takes a seat
video8346,./1k_frames_single/video8346.jpg,video8346,a man talks about a war between two generals one of which became king
video8307,./1k_frames_single/video8307.jpg,video8307,calm pond with lush green hills lining the background is shown
video9681,./1k_frames_single/video9681.jpg,video9681,sports people are fighting on field
video7828,./1k_frames_single/video7828.jpg,video7828,a man gives a lecture with a microphone in front of a laptop with a red glow behind him
video8056,./1k_frames_single/video8056.jpg,video8056,fried potatoes are being eaten
video8832,./1k_frames_single/video8832.jpg,video8832,a girl messaging her friend
video9117,./1k_frames_single/video9117.jpg,video9117,a person in white color dress wearing cloth speaking on topic white board explayning and many persons sitting displaying on screen
video8679,./1k_frames_single/video8679.jpg,video8679,a man discussed a few products
video8450,./1k_frames_single/video8450.jpg,video8450,a elecopter moving in air and red and yellow dress man hand touching speaking in snow land wearing helmet displaying on screen
video7137,./1k_frames_single/video7137.jpg,video7137,bill murray is covered in frosting
video8247,./1k_frames_single/video8247.jpg,video8247,a man is talking about cooking and presenting a thermometer and way of preparation
video9227,./1k_frames_single/video9227.jpg,video9227,man shows how to prepare potatoes
video7204,./1k_frames_single/video7204.jpg,video7204,a small boy is crying and a car is showed
video8120,./1k_frames_single/video8120.jpg,video8120,a guest is speaking with a television show host
video9823,./1k_frames_single/video9823.jpg,video9823,various rugby scenes from different games
video8489,./1k_frames_single/video8489.jpg,video8489,a tv channel named how to cook great foodcom is telling how to prepare a dish
video9245,./1k_frames_single/video9245.jpg,video9245,man interviews bill murray
video7469,./1k_frames_single/video7469.jpg,video7469,a video of a young man in a white shirt inviting his colleagues to join him
video8929,./1k_frames_single/video8929.jpg,video8929,a person is playing a video game
video8267,./1k_frames_single/video8267.jpg,video8267,video of gymasts practicing to roll
video7361,./1k_frames_single/video7361.jpg,video7361,a woman with a camel
video7349,./1k_frames_single/video7349.jpg,video7349,a grey haired man interviews someone else
video8901,./1k_frames_single/video8901.jpg,video8901,men pushing a car down assembly line
video8799,./1k_frames_single/video8799.jpg,video8799,different letters are coming out and sounding out the way they sound
video7614,./1k_frames_single/video7614.jpg,video7614,a man picking out a vehicle from the trailer
video7340,./1k_frames_single/video7340.jpg,video7340,a man is talking about his car s features while inside his car
video8475,./1k_frames_single/video8475.jpg,video8475,scrolling the the menu of movieclips with different movie trailers
video9207,./1k_frames_single/video9207.jpg,video9207,a lady is put makeup especially around her eyes
video9545,./1k_frames_single/video9545.jpg,video9545,some one talking about top ten movies of the year
video9323,./1k_frames_single/video9323.jpg,video9323,it is the video of military men
video7219,./1k_frames_single/video7219.jpg,video7219,a man drives a red indianapolis 500 type race car around an asphalt track
video9038,./1k_frames_single/video9038.jpg,video9038,a person is preparing some food
video8444,./1k_frames_single/video8444.jpg,video8444,two ladies in a cookery show explain how to marinate chicken already cleaned and ready with salt and cilantro sprigs
video8491,./1k_frames_single/video8491.jpg,video8491,a police officer pulls a gun at a swimming pool
video8652,./1k_frames_single/video8652.jpg,video8652,a man runs into the crowd when trying to catch a basketball
video7790,./1k_frames_single/video7790.jpg,video7790,a guy with glasses is standing next to some signs
video9416,./1k_frames_single/video9416.jpg,video9416,person is recording the brown horse which is having fun
video8260,./1k_frames_single/video8260.jpg,video8260,man in white hoodie turns a page to tell you about an online store the url is available in the description
video7751,./1k_frames_single/video7751.jpg,video7751,two women rare sitting speaking on sites in los angeles
video8124,./1k_frames_single/video8124.jpg,video8124,basketball players making a shot in the last seven seconds
video7556,./1k_frames_single/video7556.jpg,video7556,people are playing baseball
video8265,./1k_frames_single/video8265.jpg,video8265,someone plays a guitar and sings on stage of a tv show
video7368,./1k_frames_single/video7368.jpg,video7368,a martial arts cartoon
video9625,./1k_frames_single/video9625.jpg,video9625,its a cooking recipe show with chicken vegetables
video7134,./1k_frames_single/video7134.jpg,video7134,a class is being introduced to a digital reading device
video9521,./1k_frames_single/video9521.jpg,video9521,a person is passing by a jolly group of men
video8866,./1k_frames_single/video8866.jpg,video8866,a news scene of the dog s exercise and diet
video8812,./1k_frames_single/video8812.jpg,video8812,shows a globe and a bunch of people
video8110,./1k_frames_single/video8110.jpg,video8110,a cartoon woman cries at a bench while a woman in blue appears
video7546,./1k_frames_single/video7546.jpg,video7546,a man and a woman are talking about something
video9509,./1k_frames_single/video9509.jpg,video9509,a women in blue shows two pink lipsticks
video9549,./1k_frames_single/video9549.jpg,video9549,video of a computer program while someone navigates through its menus
video7157,./1k_frames_single/video7157.jpg,video7157,an anime cartoon character speaks to another character
video7020,./1k_frames_single/video7020.jpg,video7020,a woman creating a fondant baby and flower
video9328,./1k_frames_single/video9328.jpg,video9328,a car is racing on road
video9826,./1k_frames_single/video9826.jpg,video9826,an animated micky is driving a car
video8861,./1k_frames_single/video8861.jpg,video8861,a white male raps while another plays guitar
video9322,./1k_frames_single/video9322.jpg,video9322,a woman gets trapped in a burning trailer
video7491,./1k_frames_single/video7491.jpg,video7491,a person explaining a concept in a show
video9575,./1k_frames_single/video9575.jpg,video9575,the woman in the purple blouse talk as the shelves are behind her
video7177,./1k_frames_single/video7177.jpg,video7177,girl is dancing in the garden
video8327,./1k_frames_single/video8327.jpg,video8327,multi colored horses in a barn and outside in the snow
video7116,./1k_frames_single/video7116.jpg,video7116,a group of people are walking a woman is talking about their culture
video7118,./1k_frames_single/video7118.jpg,video7118,a young girl in a horror movie is haunted
video7695,./1k_frames_single/video7695.jpg,video7695,a man is stirring something in a pot
video7632,./1k_frames_single/video7632.jpg,video7632,a man walks between two brick buildings a dusk
video7587,./1k_frames_single/video7587.jpg,video7587,two men in a wrestling competition
video8333,./1k_frames_single/video8333.jpg,video8333,a woman is talking in the tv channel
video9773,./1k_frames_single/video9773.jpg,video9773,a boy plays grand theft auto 5
video9908,./1k_frames_single/video9908.jpg,video9908,a woman talking about education
video7576,./1k_frames_single/video7576.jpg,video7576,men are being filmed in the darkness
video7843,./1k_frames_single/video7843.jpg,video7843,a woman discusses how we can help children in a classroom
video7741,./1k_frames_single/video7741.jpg,video7741,a cartoon man in sunglasses waves at the crowd and smiles
video8572,./1k_frames_single/video8572.jpg,video8572,a man grabs at snakes and throws them around the room
video9755,./1k_frames_single/video9755.jpg,video9755,advertisement of seat basket
video9206,./1k_frames_single/video9206.jpg,video9206,a man punches a faucet to show how much better bottled water is
video9208,./1k_frames_single/video9208.jpg,video9208,a man is showing the foot well under the door jam area of the car
video9239,./1k_frames_single/video9239.jpg,video9239,a man kicks at a bull
