video_id,frame_path,frame_id,sentence
video9203,./1k_frames_single/video9203.jpg,video9203,the man is giving an informational speech to a group of people about telling someone something
video8305,./1k_frames_single/video8305.jpg,video8305,in a music video a man is laying with women while singing
video8318,./1k_frames_single/video8318.jpg,video8318,a group discusses a man s outfit
video7151,./1k_frames_single/video7151.jpg,video7151,a man is sitting on a chair
video7917,./1k_frames_single/video7917.jpg,video7917,shania twain does a closeup for her video
video7461,./1k_frames_single/video7461.jpg,video7461,a man playing video games
video7573,./1k_frames_single/video7573.jpg,video7573,a girl in white night wear dancing very sexy
video7796,./1k_frames_single/video7796.jpg,video7796,boy playing with a dump truck
video7333,./1k_frames_single/video7333.jpg,video7333,there are pictures and quotes from george bernard shaw and vincent van gogh while a voice over artist talks about making mistakes
video9775,./1k_frames_single/video9775.jpg,video9775,a man speaks to children in a classroom
video7545,./1k_frames_single/video7545.jpg,video7545,a person is playing a violin
video8934,./1k_frames_single/video8934.jpg,video8934,cameras filming near accidents between cars in traffic
video9347,./1k_frames_single/video9347.jpg,video9347,a woman in red dress explaining about cushion seat
video7562,./1k_frames_single/video7562.jpg,video7562,article about nasa s johnson space center being broadcasted on news
video9828,./1k_frames_single/video9828.jpg,video9828,assorted people are shown holding cute pets
video7377,./1k_frames_single/video7377.jpg,video7377,a guy reports on complex news
video8605,./1k_frames_single/video8605.jpg,video8605,all womans singing and dancing
video8244,./1k_frames_single/video8244.jpg,video8244,two men walk behind a couple of rhinoceroses one of which attacks a man
video7960,./1k_frames_single/video7960.jpg,video7960,a man is running around and playing a guitar
video8243,./1k_frames_single/video8243.jpg,video8243,man in black suit is having meeting with group of people
video9685,./1k_frames_single/video9685.jpg,video9685,people practising marshal arts
video7825,./1k_frames_single/video7825.jpg,video7825,sitting and converstion 2 lady and 2 gents
video7159,./1k_frames_single/video7159.jpg,video7159,bill murray is being interviewed by david letterman while talking about bill s past roles
video8839,./1k_frames_single/video8839.jpg,video8839,spongebob is showing memories of him with mr
video9228,./1k_frames_single/video9228.jpg,video9228,guy in purple tshirt playing guitar as they drive through
video9779,./1k_frames_single/video9779.jpg,video9779,fireworks are being lit and exploding in a night sky
video7583,./1k_frames_single/video7583.jpg,video7583,a princess tries not to cry in front of malificent
video8259,./1k_frames_single/video8259.jpg,video8259,an interview is conducted
video9202,./1k_frames_single/video9202.jpg,video9202,a girl singing song on stage
video8416,./1k_frames_single/video8416.jpg,video8416,a video of different racially motivated protests is playing while the song everyone s a little bit racist plays
video9819,./1k_frames_single/video9819.jpg,video9819,a reporter talks about a police incident
video8312,./1k_frames_single/video8312.jpg,video8312,the mountain views are from a boat on the center of a lake
video9691,./1k_frames_single/video9691.jpg,video9691,a commercial for the mazda 3 the card sliding around a corner
video9657,./1k_frames_single/video9657.jpg,video9657,a monkey and a man feeding monkey with hand displaying on screen
video9622,./1k_frames_single/video9622.jpg,video9622,dogs are walking across the road in a video
video7789,./1k_frames_single/video7789.jpg,video7789,a compilation of vine videos is shown
video7755,./1k_frames_single/video7755.jpg,video7755,someone speaking about a violent act regarding the police
video8660,./1k_frames_single/video8660.jpg,video8660,two teams play at the olympics
video7163,./1k_frames_single/video7163.jpg,video7163,a young man is touching a young girls back
video9308,./1k_frames_single/video9308.jpg,video9308,the models walk the catwalk
video9489,./1k_frames_single/video9489.jpg,video9489,a man with brown hair is singing a song
video8313,./1k_frames_single/video8313.jpg,video8313,a woman is discussing a new video game
video9537,./1k_frames_single/video9537.jpg,video9537,animated comic scene of guy cutting up food for dinner
video8935,./1k_frames_single/video8935.jpg,video8935,man is crossing the street with big lion and friend
video7757,./1k_frames_single/video7757.jpg,video7757,a figure in camouflage clothing walks with bent knees through large cement rooms toward a door as people are being shot
video8931,./1k_frames_single/video8931.jpg,video8931,a man playing a video game character that is carrying a sword and killing animals with it
video9248,./1k_frames_single/video9248.jpg,video9248,people are riding horses in grassland
video7597,./1k_frames_single/video7597.jpg,video7597,a man drives while discussing his car
video7025,./1k_frames_single/video7025.jpg,video7025,a naked child runs through a field
video7233,./1k_frames_single/video7233.jpg,video7233,views of two persons working on the super computer with the head phones on
video9325,./1k_frames_single/video9325.jpg,video9325,a man is driving a black car
video7353,./1k_frames_single/video7353.jpg,video7353,a minecraft video game is being played
video9688,./1k_frames_single/video9688.jpg,video9688,a person looks at a celebrity on the computer
video7599,./1k_frames_single/video7599.jpg,video7599,people compete in a backyard competition
video9023,./1k_frames_single/video9023.jpg,video9023,several shots of tv shows combined were shown here
video9309,./1k_frames_single/video9309.jpg,video9309,there is someone serving a crab dish
video8332,./1k_frames_single/video8332.jpg,video8332,someone is assembling a small hello kitty oven toy
video8328,./1k_frames_single/video8328.jpg,video8328,a man discusses and shows traits of some computer functions
video7542,./1k_frames_single/video7542.jpg,video7542,a boy gets out of a play police car and talks to a girl
video9419,./1k_frames_single/video9419.jpg,video9419,a girl talking with long hair
video8493,./1k_frames_single/video8493.jpg,video8493,polar bear jumps into water then plays around while people watch
video9223,./1k_frames_single/video9223.jpg,video9223,a man and a woman are sitting in front of a television and addressing and audience
video9813,./1k_frames_single/video9813.jpg,video9813,a man drives a motorcycle in a video game
video8815,./1k_frames_single/video8815.jpg,video8815,a man walking into a room with two kids with red helmets
video8661,./1k_frames_single/video8661.jpg,video8661,a soccer player shoots a goal during a soccer game
video8669,./1k_frames_single/video8669.jpg,video8669,anchor talking about a shows
video7162,./1k_frames_single/video7162.jpg,video7162,woman talking to a man in an interview
video9820,./1k_frames_single/video9820.jpg,video9820,a girl playing the game the sims
video9780,./1k_frames_single/video9780.jpg,video9780,an older woman who is blind is talking to a girl named lilly
video8900,./1k_frames_single/video8900.jpg,video8900,a woman bakes and decorates a cake
video9200,./1k_frames_single/video9200.jpg,video9200,animals are communicating with one another through thought bubbles in three different scenes from a video game
video7830,./1k_frames_single/video7830.jpg,video7830,this is about a young boy s photo shoot
video8111,./1k_frames_single/video8111.jpg,video8111,people are using a computer software tool
video8786,./1k_frames_single/video8786.jpg,video8786,a group of people talking about stuff
video9022,./1k_frames_single/video9022.jpg,video9022,a woman stirs up some soup sprinkles a spice in and drops a shot of liquid into it
video8803,./1k_frames_single/video8803.jpg,video8803,a man is sweeping dust off the floor
video7616,./1k_frames_single/video7616.jpg,video7616,an orange sports car accelerates quickly
video9680,./1k_frames_single/video9680.jpg,video9680,on google earth is a man who is talking about the flights
video8811,./1k_frames_single/video8811.jpg,video8811,the boy in karate dresswho is remembering the memorable hours with his father
video8089,./1k_frames_single/video8089.jpg,video8089,a police officer drives his white car onto a grassy field and then back on to the street
video8772,./1k_frames_single/video8772.jpg,video8772,the man is making a sauce in the kitchen
video9409,./1k_frames_single/video9409.jpg,video9409,a bowl of shrimp green onions and other assorted ingredients in a soup broth
video8774,./1k_frames_single/video8774.jpg,video8774,there is a guy filling a toy with cotton to play with it
video8787,./1k_frames_single/video8787.jpg,video8787,minecraft gamer puts on iron armor
video9770,./1k_frames_single/video9770.jpg,video9770,a person is connecting something to system
video8626,./1k_frames_single/video8626.jpg,video8626,numbers are displayed on the screen
video8814,./1k_frames_single/video8814.jpg,video8814,the judges make a decision
video7413,./1k_frames_single/video7413.jpg,video7413,there is a guy talking to his father
video7373,./1k_frames_single/video7373.jpg,video7373,a solider gives a speech
video9221,./1k_frames_single/video9221.jpg,video9221,a cartoon clip is being played
video7173,./1k_frames_single/video7173.jpg,video7173,a woman is mixing nailpolish and putting an egg into it
video7911,./1k_frames_single/video7911.jpg,video7911,a woman is making a recipe in a sauce pan
video9901,./1k_frames_single/video9901.jpg,video9901,a man with glasses and a goatee talking about his former job
video8851,./1k_frames_single/video8851.jpg,video8851,a group of indian guys meeting on a bridge while it s raining
video7229,./1k_frames_single/video7229.jpg,video7229,a woman is talking about movies
video8796,./1k_frames_single/video8796.jpg,video8796,man talking about hiking
video8451,./1k_frames_single/video8451.jpg,video8451,a group of young athletes race around a track
video8862,./1k_frames_single/video8862.jpg,video8862,a woman s background voice describes a virtual scene where a dog enters a bathroom
video9348,./1k_frames_single/video9348.jpg,video9348,women walking on the stage with different styles of dressing in a fashion show
video9242,./1k_frames_single/video9242.jpg,video9242,a person drawling people on a canvas
video8014,./1k_frames_single/video8014.jpg,video8014,a group of people are singing while holding coke in their hands
video8831,./1k_frames_single/video8831.jpg,video8831,many persons walking inside shoping mall hall and computer shop selling displaying on screen
video7156,./1k_frames_single/video7156.jpg,video7156,tom jones performing live on a television show
video9515,./1k_frames_single/video9515.jpg,video9515,a boy is singing
video8118,./1k_frames_single/video8118.jpg,video8118,women of a foreign nation comb their hair and perform in traditional costumes
video9838,./1k_frames_single/video9838.jpg,video9838,a cartoon clip of pokemon dancing
video9350,./1k_frames_single/video9350.jpg,video9350,screen showing some people talking
video7593,./1k_frames_single/video7593.jpg,video7593,a group of friends are in a room talking with each other
video7613,./1k_frames_single/video7613.jpg,video7613,a female journalist wearing a purple shirt and white blazer is talking on a news show next to the image of a male in a dark suit
video7834,./1k_frames_single/video7834.jpg,video7834,a man in striped collared shirt discusses jobs in news room of bloomberg
video9752,./1k_frames_single/video9752.jpg,video9752,a man is talking and more peoples are in the round
video9810,./1k_frames_single/video9810.jpg,video9810,some women models pictures are shown as a slide show presentation and a women is talking
video8122,./1k_frames_single/video8122.jpg,video8122,a fearful animation scene
video8663,./1k_frames_single/video8663.jpg,video8663,gameplay footage of someone playing minecraft
video8651,./1k_frames_single/video8651.jpg,video8651,a man talks about cars
video8918,./1k_frames_single/video8918.jpg,video8918,a hairdresser and client speak to each other with kid voices
video9026,./1k_frames_single/video9026.jpg,video9026,still photos from the 2002 movie the pianist are shown
video7586,./1k_frames_single/video7586.jpg,video7586,woman playing instruments in a field for a music video
video7223,./1k_frames_single/video7223.jpg,video7223,the small and large needles moving fast in a clock
video8044,./1k_frames_single/video8044.jpg,video8044,a goat attacks a man and the man fights back
video8656,./1k_frames_single/video8656.jpg,video8656,she used an electric blender
video8817,./1k_frames_single/video8817.jpg,video8817,a football video game is shown
video7838,./1k_frames_single/video7838.jpg,video7838,a guy is talking over loud music at the end of a youtube video
video8459,./1k_frames_single/video8459.jpg,video8459,mario and friends play in a video game together
video9776,./1k_frames_single/video9776.jpg,video9776,one micky mouse is talking to other
video9257,./1k_frames_single/video9257.jpg,video9257,a man puts his phone down to be charged
video7174,./1k_frames_single/video7174.jpg,video7174,a man rides a lft to the top of a mountain
video7436,./1k_frames_single/video7436.jpg,video7436,a man gets shot in the face
video8869,./1k_frames_single/video8869.jpg,video8869,a girl shows a pack of toy building blocks
video9603,./1k_frames_single/video9603.jpg,video9603,a woman on her way out the door gets a call from a man standing in a store
video9692,./1k_frames_single/video9692.jpg,video9692,a man in a suit is talking on a television economy program
video8128,./1k_frames_single/video8128.jpg,video8128,a cartoon character prepares to ride a bicycle
video8317,./1k_frames_single/video8317.jpg,video8317,an indian woman is applying makeup between her hair
video7164,./1k_frames_single/video7164.jpg,video7164,a computer animation using the source engine
video8908,./1k_frames_single/video8908.jpg,video8908,a white man in a suit talking in front of a tv about logic and law
video9798,./1k_frames_single/video9798.jpg,video9798,a woman peeling vegetables in her kitchen
video7776,./1k_frames_single/video7776.jpg,video7776,three soccer balls are laying in a field and then three men in black athletic cloths attempt to shoot a goal
video7111,./1k_frames_single/video7111.jpg,video7111,it is the animation cartoon
video8304,./1k_frames_single/video8304.jpg,video8304,a man dressed as a woman in a spanish language tv program
video9027,./1k_frames_single/video9027.jpg,video9027,a group of young people are playing
video8010,./1k_frames_single/video8010.jpg,video8010,lego stormtroppers are in a facility
video9679,./1k_frames_single/video9679.jpg,video9679,the demonstration of mobile rack
video7592,./1k_frames_single/video7592.jpg,video7592,a dark skinned couple make love in bed the man is on top and the woman s blouse is partly transparent
video8573,./1k_frames_single/video8573.jpg,video8573,a video of a rock group performing one of their songs
video9818,./1k_frames_single/video9818.jpg,video9818,a woman applies makeip to her eyes in double speed
video8823,./1k_frames_single/video8823.jpg,video8823,men are doing wrestling
video8507,./1k_frames_single/video8507.jpg,video8507,a girl doing gymnastics in the front yard
video8979,./1k_frames_single/video8979.jpg,video8979,sports vine clips of basketball
video9333,./1k_frames_single/video9333.jpg,video9333,barbecued cheese bacon burgers showcased
video9873,./1k_frames_single/video9873.jpg,video9873,man shows how to prepare pizza
video8916,./1k_frames_single/video8916.jpg,video8916,cartoons of a sponge a squid and a starfish
video8936,./1k_frames_single/video8936.jpg,video8936,some girls are practicing gymnastics
video9327,./1k_frames_single/video9327.jpg,video9327,men talking about and eating hot dogs
video9220,./1k_frames_single/video9220.jpg,video9220,a girl is painting easter designs on nails
video8472,./1k_frames_single/video8472.jpg,video8472,persons are attending a class with laptops
video8925,./1k_frames_single/video8925.jpg,video8925,a band plays on a stage
video9797,./1k_frames_single/video9797.jpg,video9797,a football player with a football
video8336,./1k_frames_single/video8336.jpg,video8336,video of a church chior
video8828,./1k_frames_single/video8828.jpg,video8828,tv show presenters speak about will smith and other actors and their respective characters
video9539,./1k_frames_single/video9539.jpg,video9539,the men eat the mexican food
video7570,./1k_frames_single/video7570.jpg,video7570,a very young baby is wearing a disguise and laughing
video7792,./1k_frames_single/video7792.jpg,video7792,screen cast of mine craft oneline
video9277,./1k_frames_single/video9277.jpg,video9277,models are walking the runway as part of a fashion show
video7564,./1k_frames_single/video7564.jpg,video7564,a person juggling sticks on the summit of a snowy mountain
video8601,./1k_frames_single/video8601.jpg,video8601,a man is folding pieces of paper
video8810,./1k_frames_single/video8810.jpg,video8810,a woman plays guitar and sings for a televised competition
video7146,./1k_frames_single/video7146.jpg,video7146,a puppy is crawling down some stairs
video8440,./1k_frames_single/video8440.jpg,video8440,a man hits another man while wrestling
video7572,./1k_frames_single/video7572.jpg,video7572,foreign language cooking show
video8666,./1k_frames_single/video8666.jpg,video8666,a heart is shown
video9777,./1k_frames_single/video9777.jpg,video9777,a student explains to his teacher about the sheep of another student
video7723,./1k_frames_single/video7723.jpg,video7723,a man plays an online multiplayer game and talks about how the game works
video9689,./1k_frames_single/video9689.jpg,video9689,spices being combined in a stainless steel bowl
video8320,./1k_frames_single/video8320.jpg,video8320,a young girl is showing everybody how to apply make up
video7354,./1k_frames_single/video7354.jpg,video7354,a man is showing the interior of a car
video8485,./1k_frames_single/video8485.jpg,video8485,foreign language music video
video8690,./1k_frames_single/video8690.jpg,video8690,a blonde woman is speaking and then a radio button to subscribe to her webcasts appears
video9519,./1k_frames_single/video9519.jpg,video9519,boy band performs for a crowd
video7968,./1k_frames_single/video7968.jpg,video7968,a foul mouthed chef demonstrates and describes a vegetable recipe
video9428,./1k_frames_single/video9428.jpg,video9428,presentation of the machine and its functions while working
video9236,./1k_frames_single/video9236.jpg,video9236,a man examining the length of a person s arm when opening a glove compartment
video9520,./1k_frames_single/video9520.jpg,video9520,a fat guy with a tie is looking at a man
video9822,./1k_frames_single/video9822.jpg,video9822,a woman is talking
video7686,./1k_frames_single/video7686.jpg,video7686,a man looks up towards a cathedrals organ pipes and talks to a priest in a confessional
video9231,./1k_frames_single/video9231.jpg,video9231,few barbie dolls are playing one doll puts shoe to other barbie these are used to play by a kid
video9772,./1k_frames_single/video9772.jpg,video9772,some cartoon characters are moving around an area
video7902,./1k_frames_single/video7902.jpg,video7902,a baby playing with a cats tail
video7823,./1k_frames_single/video7823.jpg,video7823,an asian woman is talking about food
video8689,./1k_frames_single/video8689.jpg,video8689,a multiplayer game of mario party is played
video8477,./1k_frames_single/video8477.jpg,video8477,city limits photograph taken from high point in day time
video7699,./1k_frames_single/video7699.jpg,video7699,a man with head band is demonstrating how to play ping pong
video8324,./1k_frames_single/video8324.jpg,video8324,a rock band performs on stage
video9012,./1k_frames_single/video9012.jpg,video9012,a trailer for a movie with a girl knocking on the wall
video8392,./1k_frames_single/video8392.jpg,video8392,a girl in black color dress wearing cloth sleeping and smoking and peeping into hole displaying on screen
video7415,./1k_frames_single/video7415.jpg,video7415,in the kitchen the chef is interviewed by a lady and the ingredients are kept on the table
video9812,./1k_frames_single/video9812.jpg,video9812,a woman giving a photoshop tutorial
video7966,./1k_frames_single/video7966.jpg,video7966,cheese is being sliced
video8456,./1k_frames_single/video8456.jpg,video8456,a man talks to someone and also the camera
video7135,./1k_frames_single/video7135.jpg,video7135,a man in a music video screams shut up a bunch of times
video8674,./1k_frames_single/video8674.jpg,video8674,space explorers in red and silver suits float about in a black abyss filled with blue crystals
video9817,./1k_frames_single/video9817.jpg,video9817,vines of sports are being played
video7370,./1k_frames_single/video7370.jpg,video7370,boys and girls dancing and singing on beach
video7228,./1k_frames_single/video7228.jpg,video7228,a man is sitting and playing guitar
video8650,./1k_frames_single/video8650.jpg,video8650,a news convention is held
video7766,./1k_frames_single/video7766.jpg,video7766,a video gamer is seen as he plays a video game
video7965,./1k_frames_single/video7965.jpg,video7965,man driving in a car an talking about the car
video8685,./1k_frames_single/video8685.jpg,video8685,a man prepares some food in the kitchen
video8670,./1k_frames_single/video8670.jpg,video8670,a black t shirted man with a hat talking about an event
video8249,./1k_frames_single/video8249.jpg,video8249,batman is beating up bane in a scene from a batman movie
video9919,./1k_frames_single/video9919.jpg,video9919,a man walks towards a woman and the woman breaks a bottle to defend her belongings
video7822,./1k_frames_single/video7822.jpg,video7822,many ladies and men are walking upstairs inside of a caged fence
video8345,./1k_frames_single/video8345.jpg,video8345,a woman feeds another
video8497,./1k_frames_single/video8497.jpg,video8497,a bus crashes into a car
video7149,./1k_frames_single/video7149.jpg,video7149,a trailer for a film with words over the top
video8462,./1k_frames_single/video8462.jpg,video8462,guys play minecraft
video7035,./1k_frames_single/video7035.jpg,video7035,there is someone playing a game in a computer
video8342,./1k_frames_single/video8342.jpg,video8342,girl in pink dress fashion model walking in ramp
video8067,./1k_frames_single/video8067.jpg,video8067,guys holding cups and talking
video9226,./1k_frames_single/video9226.jpg,video9226,a girl dresses up in a bright wig
video7687,./1k_frames_single/video7687.jpg,video7687,a girl using her smartphone
video8798,./1k_frames_single/video8798.jpg,video8798,the lighting work is going on the building
video9340,./1k_frames_single/video9340.jpg,video9340,one sad one trying to comfort
video9793,./1k_frames_single/video9793.jpg,video9793,interview with artist shanai twain
video9349,./1k_frames_single/video9349.jpg,video9349,guy showing how to make items
video8330,./1k_frames_single/video8330.jpg,video8330,a man and a woman are talking at a bus stop
video8306,./1k_frames_single/video8306.jpg,video8306,tourists walking around the mount fuji visitor center
video7793,./1k_frames_single/video7793.jpg,video7793,flight is shaken and the pilots trying to land the flight while they opened the air
video8671,./1k_frames_single/video8671.jpg,video8671,a man is yelling on the phone
video8255,./1k_frames_single/video8255.jpg,video8255,a man is playing piano
video8492,./1k_frames_single/video8492.jpg,video8492,a man is very excited
video8253,./1k_frames_single/video8253.jpg,video8253,vest of sports vines
video9342,./1k_frames_single/video9342.jpg,video9342,the water safety teams arrives with the safety devices and water bike to save a person who had been drifted away
video7029,./1k_frames_single/video7029.jpg,video7029,cartoon show for kids
video8468,./1k_frames_single/video8468.jpg,video8468,someone is driving around the city in grand theft auto v
video7419,./1k_frames_single/video7419.jpg,video7419,a man playing guitar and singing on the road side
video8464,./1k_frames_single/video8464.jpg,video8464,the ground rules of the republican presidential debate are introduced
video8978,./1k_frames_single/video8978.jpg,video8978,band performing a hard rock song about diamonds in the sky
video7464,./1k_frames_single/video7464.jpg,video7464,the video shows gameplay of a car racing video game
video8654,./1k_frames_single/video8654.jpg,video8654,a woman cooking an orange substance
video8808,./1k_frames_single/video8808.jpg,video8808,a man talks back to a cop and handcuffs him to the table
video7378,./1k_frames_single/video7378.jpg,video7378,a clip of soccer plays
video8496,./1k_frames_single/video8496.jpg,video8496,a cute girl with nice headgear standing in a room is talking through a microphone
video9332,./1k_frames_single/video9332.jpg,video9332,a girl plays a videogame
video9885,./1k_frames_single/video9885.jpg,video9885,a movie director talking to the media men in press conference regarding his movie and hero also
video7591,./1k_frames_single/video7591.jpg,video7591,a woman is giving a demonstration about pancake presentation
video8457,./1k_frames_single/video8457.jpg,video8457,a man rowing a kayak is shown in slow motion
video8665,./1k_frames_single/video8665.jpg,video8665,the tennis players wearing blue and red t shirts and play the tennis in the tennis court at the night time
video8792,./1k_frames_single/video8792.jpg,video8792,a girl is on the voice
video7375,./1k_frames_single/video7375.jpg,video7375,a man talks about the school system
video8688,./1k_frames_single/video8688.jpg,video8688,a person folds a paper airplane
video7144,./1k_frames_single/video7144.jpg,video7144,a group of women are rubbing oil and milk all over a woman
video8018,./1k_frames_single/video8018.jpg,video8018,a young girl shopping
